{
  "schemaVersion": 1,
  "contractId": "0x49b4d1e81ceec50d64f53dea0ad2bd3f60af46e3f324265e666a1b4ea9d35c74",
  "effectReceiptHash": "0xce70bfd7b1c86e94a3f4974193570a51115155a5f9b4f902f03e2fad5932ceff",
  "compensatorAddress": "0x000000000000000000000000000000000000c0de",
  "restoreArtifactHash": "0x3333000000000000000000000000000000000000000000000000000000000001",
  "outcome": "success",
  "residualMeasurements": {
    "rows_deleted": {
      "value": "1200",
      "evidenceSource": "snapshot-diff",
      "artifactHash": "0x2222000000000000000000000000000000000000000000000000000000000001"
    },
    "downtime_seconds": {
      "value": "1080",
      "evidenceSource": "provider-receipt",
      "artifactHash": "0x1111000000000000000000000000000000000000000000000000000000000002"
    }
  },
  "recoveryStartTs": 1746979500,
  "recoveryEndTs": 1746980580,
  "signature": "0x0000000000000000000000000000000000000000000000000000000000000000000000000000000000000000000000000000000000000000000000000000000000"
}
